objectid,filename,youtubeid,title,format,description,creator,institutions,date,date-is-approximate?,item_information,subject,location,latitude,longitude,related_publication,publisher-digital,source,findingaid,original-identifier,dob-dod,rights,collection,type,language,relation
wocim024,uw_633_full.jpg,,"Lena Lowe Jordan, R.N., Mosaic State Hospital",image/jpeg,"Lena Lowe Jordan was an African-American registered nurse and hospital administrator. In the 1920s, she moved to Little Rock, Arkansas from the state of Georgia and began her career as a registered nurse at the Mosaic State Hospital in 1927. In the 1930s, Lena Jordan became affiliated with the Arkansas Home and Hospital for Crippled Negro Children in Little Rock, AR. The hospital was the only charitable institution that cared for crippled black children and operated with a small budget. By 1936, in considerable financial troubles, Lena Jordan placed a mortgage on her own home to keep the hospital in operation. Subsequently, the institution was renamed the Lena Jordan Hospital by 1938. Her hospital was a twenty-bed facility equipped for general surgery, medical, and obstetric care. It was open to all black patients, regardless of their ability to pay. The physicians who made up her staff worked without pay and for charity. Notably, Lena Jordan created a program at her hospital to train new nurses. She provided the opportunity for young women to gain work experience at the hospital and obtain a practical nursing certificate for their service. Lena Jordan spent over thirty years caring for the poor and underserved communities of Little Rock, Arkansas.",,American Red Cross; Arkansas Home and Hospital for Crippled Negro Children; Charity Hospital of Savannah; Lena Jordan Hospital; Mosaic Templars Hospital,1930,no,Photograph,Health Facility Administrators; Home Care; Home Health Nursing; Midwifery; Midwives; Nurse Educators; Nurses; Obstetrics; Philanthropist,"Little Rock, AR (Pulaski County); Savannah, GA; Washington, D.C.",34.7407,-92.277,,"Historical Research Center, UAMS Library",UAMS Archives Images P790a,,,"April 6, 1884 - September 30, 1950",Transmission or reproduction of materials protected by copyright beyond that allowed by fair use requires the written permission of the copyright owners. Works not in the public domain cannot be commercially exploited without permission of the copyright owner. Responsibility for any use rests exclusively with the user.,,Image; Still Image,eng,https://hrcdigitalcollections.contentdm.oclc.org/digital/collection/uw/id/633/rec/2
wocim025,EdithIrbyJones789.jpg,,"Dr. Edith Irby Jones, UAMS",image/jpeg,"Edith Irby Jones was an American physician who was the first African American to be accepted as a non-segregated student at the University of Arkansas Medical School (now the University of Arkansas for Medical Sciences) and the first black student to attend racially mixed classes in the American South. She was the first African American to graduate from a southern medical school, first black intern in the state of Arkansas, and later the first black intern at Baylor College of Medicine. In 1985, Dr. Jones became the first woman president of the National Medical Association. In addition to her distinguished medical career, Dr. Irby Jones was an activist for civil rights working with Dr. Martin Luther King Jr. She was the only physician and female member of the Freedom Four, who spoke across the South in homes and churches encouraging people to join the civil rights movement. Over the course of her carreer, Edith irby Jones recieved many awards and honors, including induction into both the Arkansas Black Fall of Fame and the Arkansas Women's Hall of Fame.",,Association of Black Cardiologist; Baylor College of Medicine; Cook County Graduate School of Medicine; Freedman's Hospital; Knoxville College; Mercy Hospital; National Medical Association; Northwestern University; Riverside General Hospital; University of Arkansas for Medical Sciences; University of Texas Health Science Center; University of Texas Medical School; West Virginia College of Medicine,,,Photograph,Arkansas Black Hall of Fame; Arkansas Women's Hall of Fame; Comparative Medicine; Geriatrics; Internal Medicine; Physicians,"Havana (Cuba); Hot Springs, AR (Garland County); Houston, TX; Little Rock, AR (Pulaski County); Mayflower, AR (Faulkner County); Uganda (Africa); Vaudreuil (Haiti); Veracruz (Mexico)",,,,"Historical Research Center, UAMS Library","Edith Irby Jones, M.D. Collection",,,"December 23, 1927 - July 15, 2019",Transmission or reproduction of materials protected by copyright beyond that allowed by fair use requires the written permission of the copyright owners. Works not in the public domain cannot be commercially exploited without permission of the copyright owner. Responsibility for any use rests exclusively with the user.,,Image; Still Image,eng,
wocim026,0109-sophronia-williams-pic-7426.jpg,,Sophronia Reacie Williams at her church,image/jpeg,"Sophronia Reacie Williams worked as a nurse and nurse educator for forty-six years specializing in mental health. In 1979, Williams joined UAMS College of Nursing where she worked with both adult and child mental health patients. In 1994, she retired from UAMS as an associate professor. Reflecting on her impactful career, Williams observed ""I really cared. I do a lot of giving of myself to people. I did show I cared about them, treating them as human beings."" Over the course of her career in medicine, Sophronia Williams was among the first African-American nurses to integrate hospitals in Missouri, Ohio, and Colorado.",Aprille Hanson,Case Western Reserve University at Frances Payne Bolton; College of Nursing at the University of Colorado in Denver; Homer G. Phillips School of Nursing; Southern Illinois University in Carbondale; University of Arkansas for Medical Sciences; Malcolm Bliss Psychiatric Hospital; Veterans Affairs Hospital (MO); Washington University (MO),2021,no,Photograph,Mental Health; Nurses; Nurse Educators; Psychiatry,"Cleveland, OH; Denver, CO; Little Rock, AR (Pulaski County); St. Louis, MO",34.7399,-92.3303,,Arkansas Catholic,,,,,Transmission or reproduction of materials protected by copyright beyond that allowed by fair use requires the written permission of the copyright owners. Works not in the public domain cannot be commercially exploited without permission of the copyright owner. Responsibility for any use rests exclusively with the user.,,Image; Still Image,eng,https://www.arkansas-catholic.org/news/article/6810/Williams-paved-the-way-for-Black-nurses-in-Arkansas
wocim027,C60EA868.jpg,,"Group portrait of African-American Midwives in Forrest City, Arkansas",image/jpeg,"The Arkansas Board of Health took this group portrait of black midwives in Forrest City in 1929. Midwives are women specially trained to assist women in childbirth and were often called upon to deliver the baby in place of a doctor. A midwife was very knowledgeable about childbirth and the uses of medical herbs. Traditionally, Arkansas midwives learned their trade from another practicing midwife, quite often a family member. After the birth, a midwife took care of the newborn and attended to the recovery of the new mother. In the 1920s, under the Sheppard-Towner program, the Arkansas Department of Health (ADH) issued permits to midwives who attended classes and were required to pass exams to practice midwifery. Midwives remain today vital care givers in a community.",Arkansas Board of Health,Arkansas Department of Health,1929,no,Photograph,Midwives; Midwifery; Public Health,"Forrest City, AR (St. Francis County)",35.0081,-90.7898,,UA Little Rock Center for Arkansas History and Culture,,,,,Transmission or reproduction of materials protected by copyright beyond that allowed by fair use requires the written permission of the copyright owners. Works not in the public domain cannot be commercially exploited without permission of the copyright owner. Responsibility for any use rests exclusively with the user.,,Image; Still Image,eng,
wocim028,p15728coll1_11730_large.jpg,,Mamie Odessa Hale Garland training program,image/jpeg,"Group photograph of African-American women studying techinques of midwifery at J.S. Phelix high school in Marion, Arkansas. Midwives are people specially trained to assist women in childbirth and were often called upon to deliver the baby in place of a doctor. A midwife was very knowledgeable about childbirth and the uses of medical herbs. Traditionally, Arkansas midwives learned their trade from another practicing midwife, quite often a family member. After the birth, a midwife took care of the newborn and attended to the recovery of the new mother. In the 1920s, under the Sheppard-Towner program, the Arkansas Department of Health (ADH) issued permits to midwives who attended classes and were required to pass exams to practice midwifery. Midwives remain today vital care givers in a community.",,Arkansas Department of Health,1946,no,Photograph,Midwives; Midwifery; Nurse Midwives; Obstetrics,"Marion, AR (Crittenden County)",35.2145,-90.1965,,UA Little Rock Center for Arkansas History and Culture,,,,,Transmission or reproduction of materials protected by copyright beyond that allowed by fair use requires the written permission of the copyright owners. Works not in the public domain cannot be commercially exploited without permission of the copyright owner. Responsibility for any use rests exclusively with the user.,,Image; Still Image,eng,https://arstudies.contentdm.oclc.org/digital/collection/p15728coll1/id/11730/
wocim029,42679B6C.jpg,,"Suzanne Burton, Home Care Professional",image/jpeg,"Suzanne Burton of Morrilton, Arkansas was impactful in contributing to the practice of Home Care throughout central Arkansas. The pupose of Home Care is to enable chronically ill patients to remain at home with their families while still receiving medical and nursing assistance. As a Home Care nurse, Suzanne Burton provided care and comfort to her patients as well as thier loved ones. Regarding her profession, she said ""I love my work. The people on our staff provide important care to thier patients at a time when it is truely needed; in return when we come to visit we feel appreciated. It's as if we are an extended family.""",,Arkansas Baptist Hospital; Conway County Hospital; St. Anthony's Hospital; University of Central Arkansas; Visiting Nurse Association of Arkansas,1993,,Photograph,Nurses; Home Care; Home Health Nursing,"Morrilton, AR (Conway County)",35.0781,-92.4579,,"Historical Research Center, UAMS Library",Arkansas Nurses Stories: 1940s-1990s,,,,Transmission or reproduction of materials protected by copyright beyond that allowed by fair use requires the written permission of the copyright owners. Works not in the public domain cannot be commercially exploited without permission of the copyright owner. Responsibility for any use rests exclusively with the user.,,Image; Still Image,eng,
wocim030,F1_Tidwell.jpg,,"Charolette Tidwell, founder of Antioch Youth and Family",image/jpeg,"Charlotte Tidwell is a longtime resident of Fort Smith, Arkansas. In 1965, Charlotte began her studies in nursing and became the first black woman to complete the nursing program at Sparks Hospital. For over thirty years she servered her community as a nurse and hospital administrator. Upon retirement, Charlotte Tidwell founded the non-profit Antioch Youth and Family. Her organization distributes nutrituous food to needing families throughout Western Arkansas and Eastern Oklahoma and has grown to be the largest food pantry throughout the region. While retired, Tidwell considers that she is still following her calling as a nurse by addressing food insecurity in the community. She says,""The work has nothing to do with Charlotte. It's not about me. It has everything to do with knitting back communities to be whole.""","Joel Culberson, Photographer",Antioch Youth and Family; St. Edward Mercy Hospital; Sparks Regional Medical Center,2015,,Photograph,Health Facility Administrators; Nurses; Philanthropist,"Fort Smith, AR (Sebastian County)",35.393026,-94.411638,,Arkansas Living Magazine,,,,,Transmission or reproduction of materials protected by copyright beyond that allowed by fair use requires the written permission of the copyright owners. Works not in the public domain cannot be commercially exploited without permission of the copyright owner. Responsibility for any use rests exclusively with the user.,,Image; Still Image,eng,https://arkansaslivingmagazine.com/article/charolette-tidwell-action-hero/
wocim031,F1_Tidwell_nurse.jpg,,"Charolette Tidwell, Sparks Hospital",image/jpeg,"Charlotte Tidwell is a longtime resident of Fort Smith, Arkansas. In 1965, Charlotte began her studies in nursing and became the first black woman to complete the nursing program at Sparks Hospital. For over thirty years she servered her community as a nurse and hospital administrator. Upon retirement, Charlotte Tidwell founded the non-profit Antioch Youth and Family. Her organization distributes nutrituous food to needing families throughout Western Arkansas and Eastern Oklahoma and has grown to be the largest food pantry throughout the region. While retired, Tidwell considers that she is still following her calling as a nurse by addressing food insecurity in the community. She says,""The work has nothing to do with Charlotte. It's not about me. It has everything to do with knitting back communities to be whole.""",,Antioch Youth and Family; St. Edward Mercy Hospital; Sparks Regional Medical Center,1966,,Photograph,Health Facility Administrators; Nurses; Philanthropist,"Fort Smith, AR (Sebastian County)",35.3749708,-94.4195486,,Arkansas Living Magazine,,,,,Transmission or reproduction of materials protected by copyright beyond that allowed by fair use requires the written permission of the copyright owners. Works not in the public domain cannot be commercially exploited without permission of the copyright owner. Responsibility for any use rests exclusively with the user.,,Image; Still Image,eng,https://arkansaslivingmagazine.com/article/charolette-tidwell-action-hero/
wocim032,BarbaraJohnson Aug1974024.jpg,,"Barbara Johnson, UAMS Med Tech",image/jpeg,"Barbara Johnson was born in Hot Springs, Arkansas. She received her B.S. in Nursing in 1955 from the Meharry Medical College, School of Nursing in Nashville, TN. In 1972, she graduated from the University of Central Arkansas with a M.S. in Education and a M.S. in Nursing. She began her nursing career at the University of Arkansas for Medical Sciences. From 1960-1965, Barbara Johnson became the first black woman to hold the position of Operating Room head nurse. In 1966, she became the Director of Medical Services for the OEO Headstart program, and afterward joined the nursing staff of the Veterans Administration Hospital. In 1975, Governor Dale Bumpers appointed Barbara Johnson as head of the Arkansas State Board of Health of which she was the first African-American woman to become president of that organization. In 1980, she was an active member of the Little Rock Black Nurses Association and served as Corresponding Secretary. From 1991-2014 she was a Continuing Education Consultant for the Arkansas State Nurses Association, Individual Educational Activity Program. Barbara Johnson is an ARNA Hall of Fame Inductee.",,Arkansas State Health Department; Veteran's Administration Hospital; Meharry Medical College's School of Nursing; University of Central Arkansas; University of Arkansas for Medical Sciences,1974,,Photograph,Nurses; Public Health; Public Health Administration,"Hot Springs, AR (Garland County); Little Rock, AR (Pulaski County);",34.7493,-92.3206,,"Historical Research Center, UAMS Library",,,,,Transmission or reproduction of materials protected by copyright beyond that allowed by fair use requires the written permission of the copyright owners. Works not in the public domain cannot be commercially exploited without permission of the copyright owner. Responsibility for any use rests exclusively with the user.,,Image; Still Image,eng,
wocim033,Barbara-Johnson-scaled3.jpg,,"Barbara Johnson, President of the Arkansas Board of Health",image/jpeg,"Barbara Johnson was born in Hot Springs, Arkansas. She received her B.S. in Nursing in 1955 from the Meharry Medical College, School of Nursing in Nashville, TN. In 1972, she graduated from the University of Central Arkansas with a M.S. in Education and a M.S. in Nursing. She began her nursing career at the University of Arkansas for Medical Sciences. From 1960-1965, Barbara Johnson became the first black woman to hold the position of Operating Room head nurse. In 1966, she became the Director of Medical Services for the OEO Headstart program, and afterward joined the nursing staff of the Veterans Administration Hospital. In 1975, Governor Dale Bumpers appointed Barbara Johnson as head of the Arkansas State Board of Health of which she was the first African-American woman to become president of that organization. In 1980, she was an active member of the Little Rock Black Nurses Association and served as Corresponding Secretary. From 1991-2014 she was a Continuing Education Consultant for the Arkansas State Nurses Association, Individual Educational Activity Program. Barbara Johnson is an ARNA Hall of Fame Inductee.",,Arkansas State Health Department; Veteran's Administration Hospital; Meharry Medical College's School of Nursing; University of Central Arkansas; University of Arkansas for Medical Sciences,2015,no,Photograph,Nurses; Public Health; Public Health Administration,"Hot Springs, AR (Garland County); Little Rock, AR (Pulaski County)",,,,,,,,,Transmission or reproduction of materials protected by copyright beyond that allowed by fair use requires the written permission of the copyright owners. Works not in the public domain cannot be commercially exploited without permission of the copyright owner. Responsibility for any use rests exclusively with the user.,,Image; Still Image,eng,
wocim034,testbanner523-1-01.jpg,,,image/jpeg,,,,,,,,,,,,,,,,,Transmission or reproduction of materials protected by copyright beyond that allowed by fair use requires the written permission of the copyright owners. Works not in the public domain cannot be commercially exploited without permission of the copyright owner. Responsibility for any use rests exclusively with the user.,,,,
wocim035,Arkansas Midwives Deshae County Dumas AR 1-26-1928.jpg,,"Training of Arkansas Midwives in Dumas, AR",image/jpeg,"The Arkansas Department of Health performing a midwives training sesssion in Dumas, Arkansas in 1928. Midwives are women specially trained to assist women in childbirth and were often called upon to deliver the baby in place of a doctor. A midwife was very knowledgeable about childbirth and the uses of medical herbs. Traditionally, Arkansas midwives learned their trade from another practicing midwife, quite often a family member. After the birth, a midwife took care of the newborn and attended to the recovery of the new mother. In the 1920s, under the Sheppard-Towner program, the Arkansas Department of Health (ADH) issued permits to midwives who attended classes and were required to pass exams to practice midwifery. Midwives remain today vital care givers in a community.",,Arkansas Department of Health,1928,no,Photograph,Midwifery; Midwives; Public Health,"Dumas, AR (Desha County)",33.8834,-91.4835,,"Historical Research Center, UAMS Library",,,,,Transmission or reproduction of materials protected by copyright beyond that allowed by fair use requires the written permission of the copyright owners. Works not in the public domain cannot be commercially exploited without permission of the copyright owner. Responsibility for any use rests exclusively with the user.,,,,
wocim036,Arkansas Midwives 2 Deshae County Dumas AR 1-26-1928.jpg,,Arkansas Midwives of Desha County,image/jpeg,"A group of Arkansas midwives from Desha County pose for a photograph taken in 1928. Midwives are women specially trained to assist women in childbirth and were often called upon to deliver the baby in place of a doctor. A midwife was very knowledgeable about childbirth and the uses of medical herbs. Traditionally, Arkansas midwives learned their trade from another practicing midwife, quite often a family member. After the birth, a midwife took care of the newborn and attended to the recovery of the new mother. In the 1920s, under the Sheppard-Towner program, the Arkansas Department of Health (ADH) issued permits to midwives who attended classes and were required to pass exams to practice midwifery. Midwives remain today vital care givers in a community.",,Arkansas Department of Health,1928,no,Photograph,Midwifery; Midwives; Public Health,"Dumas, AR (Desha County)",33.8834,-91.4835,,"Historical Research Center, UAMS Library",,,,,Transmission or reproduction of materials protected by copyright beyond that allowed by fair use requires the written permission of the copyright owners. Works not in the public domain cannot be commercially exploited without permission of the copyright owner. Responsibility for any use rests exclusively with the user.,,,,
wocim037,97.292.3C_a.jpg,,"Woman in United States Cadet Nurse Corps uniform sitting in garden, Rohwer, Arkansas, September 23, 1944",image/jpeg,"Following the attack on Pearly Harbor on December 7, 1941, President Franklin Roosevelt established the War Relocation Authority (WRA) for the relocation, maintenance, and supervision of the Japanese American population. According to registration records, of the 120,000 Japanese Americans interned into the camps some 130 were registered nurses and 70 were registered midwives. In this photograph, a woman in United States Cadet Nurse Corps uniform sits in a garden at the Rohwer Relocation Camp.","Muramoto, Walter",US Army Nursing Corps,1944,no,Photograph,"Japanese American--Evacuation and relocation, 1942-1945; Nurses; Rohwer Relocation Center (Ark.)","Rohwer, AR (Desha County)",33.7664,-91.2803,,Japanese American National Museum,,,,,Transmission or reproduction of materials protected by copyright beyond that allowed by fair use requires the written permission of the copyright owners. Works not in the public domain cannot be commercially exploited without permission of the copyright owner. Responsibility for any use rests exclusively with the user.,,,,
wocim038,janm_97.292.10G_a.jpg,,"Nurse carrying newborn infant, Rohwer, Arkansas",image/jpeg,"Following the attack on Pearly Harbor on December 7, 1941, President Franklin Roosevelt established the War Relocation Authority (WRA) for the relocation, maintenance, and supervision of the Japanese American population. According to registration records, of the 120,000 Japanese Americans interned into the camps some 130 were registered nurses and 70 were registered midwives. In this photograph, a Japaense American nurse holds a new born infant at the Rohwer War Relocation Center.","Muramoto, Walter",US Army Nursing Corps,1944,no,Photograph,"Japanese American--Evacuation and relocation, 1942-1945; Midwifery; Midwives; Rohwer Relocation Center (Ark.)","Rohwer, AR (Desha County)",33.7664,-91.2803,,Japanese American National Museum,,,,,Transmission or reproduction of materials protected by copyright beyond that allowed by fair use requires the written permission of the copyright owners. Works not in the public domain cannot be commercially exploited without permission of the copyright owner. Responsibility for any use rests exclusively with the user.,,,,https://janm.emuseum.com/objects/26076/woman-in-united-states-cadet-nurse-corps-uniform-sitting-in
wocim039,MaudHines.jpg,,"Maud Hines in Red Cross uniform, 1918",image/jpeg,"At the outset of World War I, African-American women sought inclusion in the US Army Nurse Corps to serve in the war effort. Some did so due to patriotic fervor while others wished to demonstrate that were loyal Americans who deserved the full benefits of citizenship. They faced exceptional barriers due to societal views on sex and race. It was not until July 1918 that African-American women were included as reserve nurses in the American Red Cross. They were allowed to contribute strictly as reserve in case of emergency. That crisis occurred in October 1918 with the outbreak of the Spanish Influenza. In the face of pandemic, black nurses were badly needed to tend to the sick. Maud Hines was one such nurse who was deployed to combat the viral outbreak at Camp Pike in Little Rock, Arkansas.",,American Red Cross,1918,no,Photograph,"Camp Pike (Ark.); Nurses; Public Health; Spanish Influenza Epidemic, 1918-1919","Little Rock, AR (Pulaski County)",34.825,-92.2875,,Arkansas State Archives,,,,,Transmission or reproduction of materials protected by copyright beyond that allowed by fair use requires the written permission of the copyright owners. Works not in the public domain cannot be commercially exploited without permission of the copyright owner. Responsibility for any use rests exclusively with the user.,,,,http://arkansasstatearchives.blogspot.com/2020/04/research-family-stories-from-spanish.html
